SUBJECT_ID,HADM_ID,SEQ_NUM,ICD9_CODE,SHORT_TITLE,LONG_TITLE,ICUSTAY_ID,HCUP_CCS_2015,USE_IN_BENCHMARK
10112,188574,1,42741,VENTRICULAR FIBRILLATION,VENTRICULAR FIBRILLATION,224063,Cardiac arrest and ventricular fibrillation,0
10112,188574,2,51881,ACUTE RESPIRATRY FAILURE,ACUTE RESPIRATORY FAILURE,224063,Respiratory failure; insufficiency; arrest (adult),1
10112,188574,3,3481,ANOXIC BRAIN DAMAGE,ANOXIC BRAIN DAMAGE,224063,Coma; stupor; and brain damage,0
10112,188574,4,78003,PERSISTENT VEGTV STATE,PERSISTENT VEGETATIVE STATE,224063,Coma; stupor; and brain damage,0
10112,188574,5,53081,ESOPHAGEAL REFLUX,ESOPHAGEAL REFLUX,224063,Esophageal disorders,0
10112,188574,6,2967,BIPOLOR I CURRENT NOS,"BIPOLAR I DISORDER, MOST RECENT EPISODE (OR CURRENT) UNSPECIFIED",224063,Mood disorders,0
10112,188574,7,2449,HYPOTHYROIDISM NOS,UNSPECIFIED ACQUIRED HYPOTHYROIDISM,224063,Thyroid disorders,0
10112,188574,8,3320,PARALYSIS AGITANS,PARALYSIS AGITANS,224063,Parkinson`s disease,0
10112,188574,9,56210,DVRTCLO COLON W/O HMRHG,DIVERTICULOSIS OF COLON (WITHOUT MENTION OF HEMORRHAGE),224063,Diverticulosis and diverticulitis,0
