SUBJECT_ID,HADM_ID,SEQ_NUM,ICD9_CODE,SHORT_TITLE,LONG_TITLE,ICUSTAY_ID,HCUP_CCS_2015,USE_IN_BENCHMARK
10089,190301,1,431,INTRACEREBRAL HEMORRHAGE,INTRACEREBRAL HEMORRHAGE,246080,Acute cerebrovascular disease,1
10089,190301,2,5070,FOOD/VOMIT PNEUMONITIS,PNEUMONITIS DUE TO INHALATION OF FOOD OR VOMITUS,246080,Aspiration pneumonitis; food/vomitus,0
10089,190301,3,4019,HYPERTENSION NOS,UNSPECIFIED ESSENTIAL HYPERTENSION,246080,Essential hypertension,1
10089,190301,4,V4581,AORTOCORONARY BYPASS,AORTOCORONARY BYPASS STATUS,246080,Coronary atherosclerosis and other heart disease,1
10089,190301,5,41400,COR ATH UNSP VSL NTV/GFT,"CORONARY ATHEROSCLEROSIS OF UNSPECIFIED TYPE OF VESSEL, NATIVE OR GRAFT",246080,Coronary atherosclerosis and other heart disease,1
