ICD9_CODE,SHORT_TITLE,LONG_TITLE,COUNT
99591,SEPSIS,SEPSIS,9
99662,REACT-OTH VASC DEV/GRAFT,"INFECTION AND INFLAMMATORY REACTION DUE TO OTHER VASCULAR DEVICE, IMPLANT, AND GRAFT",1
40391,HYP KID NOS W CR KID V,"HYPERTENSIVE CHRONIC KIDNEY DISEASE, UNSPECIFIED, WITH CHRONIC KIDNEY DISEASE STAGE V OR END STAGE RENAL DISEASE",6
42731,ATRIAL FIBRILLATION,ATRIAL FIBRILLATION,43
4280,CHF NOS,"CONGESTIVE HEART FAILURE, UNSPECIFIED",34
4241,AORTIC VALVE DISORDER,AORTIC VALVE DISORDERS,5
4240,MITRAL VALVE DISORDER,MITRAL VALVE DISORDERS,10
03819,STAPHYLCOCC SEPTICEM NEC,OTHER STAPHYLOCOCCAL SEPTICEMIA,1
7850,TACHYCARDIA NOS,"TACHYCARDIA, UNSPECIFIED",2
E8791,ABN REACT-RENAL DIALYSIS,"KIDNEY DIALYSIS AS THE CAUSE OF ABNORMAL REACTION OF PATIENT, OR OF LATER COMPLICATION, WITHOUT MENTION OF MISADVENTURE AT TIME OF PROCEDURE",1
V090,INF MCRG RSTN PNCLLINS,INFECTION WITH MICROORGANISMS RESISTANT TO PENICILLINS,3
56211,DVRTCLI COLON W/O HMRHG,DIVERTICULITIS OF COLON (WITHOUT MENTION OF HEMORRHAGE),2
28529,ANEMIA-OTHER CHRONIC DIS,ANEMIA OF OTHER CHRONIC DISEASE,4
25000,DMII WO CMP NT ST UNCNTR,"DIABETES MELLITUS WITHOUT MENTION OF COMPLICATION, TYPE II OR UNSPECIFIED TYPE, NOT STATED AS UNCONTROLLED",28
V5867,LONG-TERM USE OF INSULIN,LONG-TERM (CURRENT) USE OF INSULIN,8
E9342,ADV EFF ANTICOAGULANTS,ANTICOAGULANTS CAUSING ADVERSE EFFECTS IN THERAPEUTIC USE,2
41401,CRNRY ATHRSCL NATVE VSSL,CORONARY ATHEROSCLEROSIS OF NATIVE CORONARY ARTERY,16
2749,GOUT NOS,"GOUT, UNSPECIFIED",4
3051,TOBACCO USE DISORDER,TOBACCO USE DISORDER,4
2875,THROMBOCYTOPENIA NOS,"THROMBOCYTOPENIA, UNSPECIFIED",9
4019,HYPERTENSION NOS,UNSPECIFIED ESSENTIAL HYPERTENSION,48
2948,MENTAL DISOR NEC OTH DIS,OTHER PERSISTENT MENTAL DISORDERS DUE TO CONDITIONS CLASSIFIED ELSEWHERE,9
79092,ABNRML COAGULTION PRFILE,ABNORMAL COAGULATION PROFILE,4
0380,STREPTOCOCCAL SEPTICEMIA,STREPTOCOCCAL SEPTICEMIA,2
42830,DIASTOLC HRT FAILURE NOS,"DIASTOLIC HEART FAILURE, UNSPECIFIED",2
5849,ACUTE KIDNEY FAILURE NOS,"ACUTE KIDNEY FAILURE, UNSPECIFIED",37
99667,REACT-OTH INT ORTHO DEV,"INFECTION AND INFLAMMATORY REACTION DUE TO OTHER INTERNAL ORTHOPEDIC DEVICE, IMPLANT, AND GRAFT",1
71105,PYOGEN ARTHRITIS-PELVIS,"PYOGENIC ARTHRITIS, PELVIC REGION AND THIGH",1
2763,ALKALOSIS,ALKALOSIS,4
99677,COMP-INTERNAL JOINT PROS,OTHER COMPLICATIONS DUE TO INTERNAL JOINT PROSTHESIS,1
7837,FAILURE TO THRIVE-ADULT,ADULT FAILURE TO THRIVE,1
45981,VENOUS INSUFFICIENCY NOS,"VENOUS (PERIPHERAL) INSUFFICIENCY, UNSPECIFIED",4
E8781,ABN REACT-ARTIF IMPLANT,"SURGICAL OPERATION WITH IMPLANT OF ARTIFICIAL INTERNAL DEVICE CAUSING ABNORMAL PATIENT REACTION, OR LATER COMPLICATION,WITHOUT MENTION OF MISADVENTURE AT TIME OF OPERATION",2
E8498,ACCIDENT IN PLACE NEC,ACCIDENTS OCCURRING IN OTHER SPECIFIED PLACES,1
73300,OSTEOPOROSIS NOS,"OSTEOPOROSIS, UNSPECIFIED",4
04102,STREPTOCOCCUS GROUP B,"STREPTOCOCCUS INFECTION IN CONDITIONS CLASSIFIED ELSEWHERE AND OF UNSPECIFIED SITE, STREPTOCOCCUS, GROUP B",1
0389,SEPTICEMIA NOS,UNSPECIFIED SEPTICEMIA,22
5990,URIN TRACT INFECTION NOS,"URINARY TRACT INFECTION, SITE NOT SPECIFIED",22
78552,SEPTIC SHOCK,SEPTIC SHOCK,15
4439,PERIPH VASCULAR DIS NOS,"PERIPHERAL VASCULAR DISEASE, UNSPECIFIED",10
V4582,STATUS-POST PTCA,PERCUTANEOUS TRANSLUMINAL CORONARY ANGIOPLASTY STATUS,4
3320,PARALYSIS AGITANS,PARALYSIS AGITANS,4
29041,VASC DEMENTIA W DELIRIUM,"VASCULAR DEMENTIA, WITH DELIRIUM",1
4370,CEREBRAL ATHEROSCLEROSIS,CEREBRAL ATHEROSCLEROSIS,2
V441,GASTROSTOMY STATUS,GASTROSTOMY STATUS,2
41400,COR ATH UNSP VSL NTV/GFT,"CORONARY ATHEROSCLEROSIS OF UNSPECIFIED TYPE OF VESSEL, NATIVE OR GRAFT",6
V4581,AORTOCORONARY BYPASS,AORTOCORONARY BYPASS STATUS,8
V1079,HX-LYMPHATIC MALIGN NEC,PERSONAL HISTORY OF OTHER LYMPHATIC AND HEMATOPOIETIC NEOPLASMS,1
V1201,PRSNL HST TUBERCULOSIS,PERSONAL HISTORY OF TUBERCULOSIS,3
41071,"SUBENDO INFARCT, INITIAL","SUBENDOCARDIAL INFARCTION, INITIAL EPISODE OF CARE",9
1983,SEC MAL NEO BRAIN/SPINE,SECONDARY MALIGNANT NEOPLASM OF BRAIN AND SPINAL CORD,4
V1042,HX-UTERUS MALIGNANCY NEC,PERSONAL HISTORY OF MALIGNANT NEOPLASM OF OTHER PARTS OF UTERUS,2
5121,IATROGENIC PNEUMOTHORAX,IATROGENIC PNEUMOTHORAX,2
1124,CANDIDIASIS OF LUNG,CANDIDIASIS OF LUNG,1
41519,PULM EMBOL/INFARCT NEC,OTHER PULMONARY EMBOLISM AND INFARCTION,3
1622,MALIG NEO MAIN BRONCHUS,MALIGNANT NEOPLASM OF MAIN BRONCHUS,1
496,CHR AIRWAY OBSTRUCT NEC,"CHRONIC AIRWAY OBSTRUCTION, NOT ELSEWHERE CLASSIFIED",10
5750,ACUTE CHOLECYSTITIS,ACUTE CHOLECYSTITIS,3
5601,PARALYTIC ILEUS,PARALYTIC ILEUS,2
34590,EPILEP NOS W/O INTR EPIL,"EPILEPSY, UNSPECIFIED, WITHOUT MENTION OF INTRACTABLE EPILEPSY",2
33385,SUBAC DYSKINESA D/T DRUG,SUBACUTE DYSKINESIA DUE TO DRUGS,1
E9479,ADV EFF MEDICINAL NOS,UNSPECIFIED DRUG OR MEDICINAL SUBSTANCE CAUSING ADVERSE EFFECTS IN THERAPEUTIC USE,1
29570,SCHIZOAFFECTIVE DIS NOS,"SCHIZOAFFECTIVE DISORDER, UNSPECIFIED",1
2724,HYPERLIPIDEMIA NEC/NOS,OTHER AND UNSPECIFIED HYPERLIPIDEMIA,26
6826,CELLULITIS OF LEG,"CELLULITIS AND ABSCESS OF LEG, EXCEPT FOOT",2
42781,SINOATRIAL NODE DYSFUNCT,SINOATRIAL NODE DYSFUNCTION,3
40390,HY KID NOS W CR KID I-IV,"HYPERTENSIVE CHRONIC KIDNEY DISEASE, UNSPECIFIED, WITH CHRONIC KIDNEY DISEASE STAGE I THROUGH STAGE IV, OR UNSPECIFIED",9
42822,CHR SYSTOLIC HRT FAILURE,CHRONIC SYSTOLIC HEART FAILURE,2
2768,HYPOPOTASSEMIA,HYPOPOTASSEMIA,6
0388,SEPTICEMIA NEC,OTHER SPECIFIED SEPTICEMIAS,1
5854,CHR KIDNEY DIS STAGE IV,"CHRONIC KIDNEY DISEASE, STAGE IV (SEVERE)",1
53551,GSTR/DDNTS NOS W HMRHG,"UNSPECIFIED GASTRITIS AND GASTRODUODENITIS, WITH HEMORRHAGE",1
70714,ULCER OF HEEL & MIDFOOT,ULCER OF HEEL AND MIDFOOT,1
25002,DMII WO CMP UNCNTRLD,"DIABETES MELLITUS WITHOUT MENTION OF COMPLICATION, TYPE II OR UNSPECIFIED TYPE, UNCONTROLLED",2
2760,HYPEROSMOLALITY,HYPEROSMOLALITY AND/OR HYPERNATREMIA,15
3569,IDIO PERIPH NEURPTHY NOS,UNSPECIFIED HEREDITARY AND IDIOPATHIC PERIPHERAL NEUROPATHY,2
5070,FOOD/VOMIT PNEUMONITIS,PNEUMONITIS DUE TO INHALATION OF FOOD OR VOMITUS,16
311,DEPRESSIVE DISORDER NEC,"DEPRESSIVE DISORDER, NOT ELSEWHERE CLASSIFIED",15
2449,HYPOTHYROIDISM NOS,UNSPECIFIED ACQUIRED HYPOTHYROIDISM,20
V1582,HISTORY OF TOBACCO USE,PERSONAL HISTORY OF TOBACCO USE,5
V5861,LONG-TERM USE ANTICOAGUL,LONG-TERM (CURRENT) USE OF ANTICOAGULANTS,17
70703,"PRESSURE ULCER, LOW BACK","PRESSURE ULCER, LOWER BACK",13
V440,TRACHEOSTOMY STATUS,TRACHEOSTOMY STATUS,9
3441,PARAPLEGIA NOS,PARAPLEGIA,2
43853,LT EF OTH PARALS-BILAT,"LATE EFFECTS OF CEREBROVASCULAR DISEASE, OTHER PARALYTIC SYNDROME, BILATERAL",3
70723,"PRESSURE ULCER,STAGE III","PRESSURE ULCER, STAGE III",3
7810,ABN INVOLUN MOVEMENT NEC,ABNORMAL INVOLUNTARY MOVEMENTS,1
V444,ENTEROSTOMY STATUS NEC,STATUS OF OTHER ARTIFICIAL OPENING OF GASTROINTESTINAL TRACT,1
V442,ILEOSTOMY STATUS,ILEOSTOMY STATUS,3
2859,ANEMIA NOS,"ANEMIA, UNSPECIFIED",23
70720,"PRESSURE ULCER,STAGE NOS","PRESSURE ULCER, UNSPECIFIED STAGE",4
25060,DMII NEURO NT ST UNCNTRL,"DIABETES WITH NEUROLOGICAL MANIFESTATIONS, TYPE II OR UNSPECIFIED TYPE, NOT STATED AS UNCONTROLLED",11
3572,NEUROPATHY IN DIABETES,POLYNEUROPATHY IN DIABETES,12
43819,LATE EF-SPCH/LANG DF NEC,"LATE EFFECTS OF CEREBROVASCULAR DISEASE, OTHER SPEECH AND LANGUAGE DEFICITS",2
99664,REACT-INDWELL URIN CATH,INFECTION AND INFLAMMATORY REACTION DUE TO INDWELLING URINARY CATHETER,2
03840,GRAM-NEG SEPTICEMIA NOS,"SEPTICEMIA DUE TO GRAM-NEGATIVE ORGANISM, UNSPECIFIED",1
70722,"PRESSURE ULCER, STAGE II","PRESSURE ULCER, STAGE II",4
V1254,HX TIA/STROKE W/O RESID,"PERSONAL HISTORY OF TRANSIENT ISCHEMIC ATTACK (TIA), AND CEREBRAL INFARCTION WITHOUT RESIDUAL DEFICITS",2
48283,PNEUMO OTH GRM-NEG BACT,PNEUMONIA DUE TO OTHER GRAM-NEGATIVE BACTERIA,2
53649,GASTROSTOMY COMP NEC,OTHER GASTROSTOMY COMPLICATIONS,2
0416,PROTEUS INFECTION NOS,PROTEUS (MIRABILIS) (MORGANII) INFECTION IN CONDITIONS CLASSIFIED ELSEWHERE AND OF UNSPECIFIED SITE,1
E8796,ABN REACT-URINARY CATH,"URINARY CATHETERIZATION AS THE CAUSE OF ABNORMAL REACTION OF PATIENT, OR OF LATER COMPLICATION, WITHOUT MENTION OF MISADVENTURE AT TIME OF PROCEDURE",2
99592,SEVERE SEPSIS,SEVERE SEPSIS,22
99673,COMP-REN DIALYS DEV/GRFT,"OTHER COMPLICATIONS DUE TO RENAL DIALYSIS DEVICE, IMPLANT, AND GRAFT",1
5761,CHOLANGITIS,CHOLANGITIS,2
57451,CHOLEDOCHLITH NOS W OBST,"CALCULUS OF BILE DUCT WITHOUT MENTION OF CHOLECYSTITIS, WITH OBSTRUCTION",1
5856,END STAGE RENAL DISEASE,END STAGE RENAL DISEASE,4
51882,OTHER PULMONARY INSUFF,"OTHER PULMONARY INSUFFICIENCY, NOT ELSEWHERE CLASSIFIED",2
5119,PLEURAL EFFUSION NOS,UNSPECIFIED PLEURAL EFFUSION,9
99659,MALFUNC OTH DEVICE/GRAFT,"MECHANICAL COMPLICATION DUE TO OTHER IMPLANT AND INTERNAL DEVICE, NOT ELSEWHERE CLASSIFIED",2
7211,CERV SPONDYL W MYELOPATH,CERVICAL SPONDYLOSIS WITH MYELOPATHY,1
V1588,PERSONAL HISTORY OF FALL,HISTORY OF FALL,1
2380,UNC BEHAV NEO BONE,NEOPLASM OF UNCERTAIN BEHAVIOR OF BONE AND ARTICULAR CARTILAGE,1
2930,DELIRIUM D/T OTHER COND,DELIRIUM DUE TO CONDITIONS CLASSIFIED ELSEWHERE,7
V4502,STATUS AUTM CRD DFBRLTR,AUTOMATIC IMPLANTABLE CARDIAC DEFIBRILLATOR IN SITU,1
V1046,HX-PROSTATIC MALIGNANCY,PERSONAL HISTORY OF MALIGNANT NEOPLASM OF PROSTATE,1
486,"PNEUMONIA, ORGANISM NOS","PNEUMONIA, ORGANISM UNSPECIFIED",22
58881,SEC HYPERPARATHYRD-RENAL,SECONDARY HYPERPARATHYROIDISM (OF RENAL ORIGIN),1
78009,OTHER ALTER CONSCIOUSNES,OTHER ALTERATION OF CONSCIOUSNESS,2
V4511,RENAL DIALYSIS STATUS,RENAL DIALYSIS STATUS,1
71946,JOINT PAIN-L/LEG,"PAIN IN JOINT, LOWER LEG",1
V0254,METH RESIS STAPH CARRIER,CARRIER OR SUSPECTED CARRIER OF METHICILLIN RESISTANT STAPHYLOCOCCUS AUREUS,3
2761,HYPOSMOLALITY,HYPOSMOLALITY AND/OR HYPONATREMIA,15
1985,SECONDARY MALIG NEO BONE,SECONDARY MALIGNANT NEOPLASM OF BONE AND BONE MARROW,6
1977,SECOND MALIG NEO LIVER,"MALIGNANT NEOPLASM OF LIVER, SECONDARY",8
1970,SECONDARY MALIG NEO LUNG,SECONDARY MALIGNANT NEOPLASM OF LUNG,8
2800,CHR BLOOD LOSS ANEMIA,IRON DEFICIENCY ANEMIA SECONDARY TO BLOOD LOSS (CHRONIC),5
V1251,HX-VEN THROMBOSIS/EMBOLS,PERSONAL HISTORY OF VENOUS THROMBOSIS AND EMBOLISM,6
56400,CONSTIPATION NOS,"CONSTIPATION, UNSPECIFIED",2
45340,AC DVT/EMBL LOW EXT NOS,ACUTE VENOUS EMBOLISM AND THROMBOSIS OF UNSPECIFIED DEEP VESSELS OF LOWER EXTREMITY,3
1508,MAL NEO ESOPHAGUS NEC,MALIGNANT NEOPLASM OF OTHER SPECIFIED PART OF ESOPHAGUS,2
53082,ESOPHAGEAL HEMORRHAGE,ESOPHAGEAL HEMORRHAGE,1
V420,KIDNEY TRANSPLANT STATUS,KIDNEY REPLACED BY TRANSPLANT,2
5789,GASTROINTEST HEMORR NOS,"HEMORRHAGE OF GASTROINTESTINAL TRACT, UNSPECIFIED",5
32723,OBSTRUCTIVE SLEEP APNEA,OBSTRUCTIVE SLEEP APNEA (ADULT)(PEDIATRIC),4
71940,JOINT PAIN-UNSPEC,"PAIN IN JOINT, SITE UNSPECIFIED",1
53190,STOMACH ULCER NOS,"GASTRIC ULCER, UNSPECIFIED AS ACUTE OR CHRONIC, WITHOUT MENTION OF HEMORRHAGE OR PERFORATION, WITHOUT MENTION OF OBSTRUCTION",1
570,ACUTE NECROSIS OF LIVER,ACUTE AND SUBACUTE NECROSIS OF LIVER,5
51881,ACUTE RESPIRATRY FAILURE,ACUTE RESPIRATORY FAILURE,25
5845,"AC KIDNY FAIL, TUBR NECR",ACUTE KIDNEY FAILURE WITH LESION OF TUBULAR NECROSIS,4
5722,HEPATIC ENCEPHALOPATHY,HEPATIC ENCEPHALOPATHY,4
5711,AC ALCOHOLIC HEPATITIS,ACUTE ALCOHOLIC HEPATITIS,2
452,PORTAL VEIN THROMBOSIS,PORTAL VEIN THROMBOSIS,3
3481,ANOXIC BRAIN DAMAGE,ANOXIC BRAIN DAMAGE,3
03811,METH SUSC STAPH AUR SEPT,METHICILLIN SUSCEPTIBLE STAPHYLOCOCCUS AUREUS SEPTICEMIA,1
5712,ALCOHOL CIRRHOSIS LIVER,ALCOHOLIC CIRRHOSIS OF LIVER,4
48241,METH SUS PNEUM D/T STAPH,METHICILLIN SUSCEPTIBLE PNEUMONIA DUE TO STAPHYLOCOCCUS AUREUS,2
78959,ASCITES NEC,OTHER ASCITES,2
28731,IMMUNE THROMBOCYT PURPRA,IMMUNE THROMBOCYTOPENIC PURPURA,1
5566,UNIVRSL ULCERTVE COLITIS,UNIVERSAL ULCERATIVE (CHRONIC) COLITIS,1
5855,CHRON KIDNEY DIS STAGE V,"CHRONIC KIDNEY DISEASE, STAGE V",1
2839,ACQ HEMOLYTIC ANEMIA NOS,"ACQUIRED HEMOLYTIC ANEMIA, UNSPECIFIED",1
78551,CARDIOGENIC SHOCK,CARDIOGENIC SHOCK,4
20280,OTH LYMP UNSP XTRNDL ORG,"OTHER MALIGNANT LYMPHOMAS, UNSPECIFIED SITE, EXTRANODAL AND SOLID ORGAN SITES",3
3970,TRICUSPID VALVE DISEASE,DISEASES OF TRICUSPID VALVE,5
4266,OTHER HEART BLOCK,OTHER HEART BLOCK,1
5859,CHRONIC KIDNEY DIS NOS,"CHRONIC KIDNEY DISEASE, UNSPECIFIED",9
5691,RECTAL PROLAPSE,RECTAL PROLAPSE,1
24220,TOX MULTNOD GOIT NO CRIS,TOXIC MULTINODULAR GOITER WITHOUT MENTION OF THYROTOXIC CRISIS OR STORM,1
51919,TRACHEA & BRONCH DIS NEC,OTHER DISEASES OF TRACHEA AND BRONCHUS,3
2767,HYPERPOTASSEMIA,HYPERPOTASSEMIA,3
E8889,FALL NOS,UNSPECIFIED FALL,3
2720,PURE HYPERCHOLESTEROLEM,PURE HYPERCHOLESTEROLEMIA,4
43811,LATE EFF CV DIS-APHASIA,"LATE EFFECTS OF CEREBROVASCULAR DISEASE, APHASIA",2
53390,PEPTIC ULCER NOS,"PEPTIC ULCER OF UNSPECIFIED SITE, UNSPECIFIED AS ACUTE OR CHRONIC, WITHOUT MENTION OF HEMORRHAGE OR PERFORATION, WITHOUT MENTION OF OBSTRUCTION",3
9971,SURG COMPL-HEART,"CARDIAC COMPLICATIONS, NOT ELSEWHERE CLASSIFIED",3
4271,PAROX VENTRIC TACHYCARD,PAROXYSMAL VENTRICULAR TACHYCARDIA,3
4160,PRIM PULM HYPERTENSION,PRIMARY PULMONARY HYPERTENSION,3
5939,RENAL & URETERAL DIS NOS,UNSPECIFIED DISORDER OF KIDNEY AND URETER,2
28522,ANEMIA IN NEOPLASTIC DIS,ANEMIA IN NEOPLASTIC DISEASE,2
80125,CL SKL BASE FX-DEEP COMA,"CLOSED FRACTURE OF BASE OF SKULL WITH SUBARACHNOID, SUBDURAL, AND EXTRADURAL HEMORRHAGE, WITH PROLONGED [MORE THAN 24 HOURS] LOSS OF CONSCIOUSNESS, WITHOUT RETURN TO PRE-EXISTING CONSCIOUS LEVEL",1
8602,TRAUM HEMOTHORAX-CLOSED,TRAUMATIC HEMOTHORAX WITHOUT MENTION OF OPEN WOUND INTO THORAX,1
E8348,W/CRFT FALL NEC-PERS NEC,OTHER FALL FROM ONE LEVEL TO ANOTHER IN WATER TRANSPORT INJURING OTHER SPECIFIED PERSON,1
2851,AC POSTHEMORRHAG ANEMIA,ACUTE POSTHEMORRHAGIC ANEMIA,9
56985,ANGIO INTES W HMRHG,ANGIODYSPLASIA OF INTESTINE WITH HEMORRHAGE,1
39891,RHEUMATIC HEART FAILURE,RHEUMATIC HEART FAILURE (CONGESTIVE),2
3962,MITRAL INSUF/AORT STENOS,MITRAL VALVE INSUFFICIENCY AND AORTIC VALVE STENOSIS,2
42789,CARDIAC DYSRHYTHMIAS NEC,OTHER SPECIFIED CARDIAC DYSRHYTHMIAS,5
78057,SLEEP APNEA NOS,UNSPECIFIED SLEEP APNEA,1
5770,ACUTE PANCREATITIS,ACUTE PANCREATITIS,3
7907,BACTEREMIA,BACTEREMIA,4
5754,PERFORATION GALLBLADDER,PERFORATION OF GALLBLADDER,1
34982,TOXIC ENCEPHALOPATHY,TOXIC ENCEPHALOPATHY,1
412,OLD MYOCARDIAL INFARCT,OLD MYOCARDIAL INFARCTION,3
53240,CHR DUODEN ULCER W HEM,"CHRONIC OR UNSPECIFIED DUODENAL ULCER WITH HEMORRHAGE, WITHOUT MENTION OF OBSTRUCTION",1
53140,CHR STOMACH ULC W HEM,"CHRONIC OR UNSPECIFIED GASTRIC ULCER WITH HEMORRHAGE, WITHOUT MENTION OF OBSTRUCTION",1
E8859,FALL FROM SLIPPING NEC,"FALL FROM OTHER SLIPPING, TRIPPING, OR STUMBLING",3
E8788,ABN REACT-SURG PROC NEC,"OTHER SPECIFIED SURGICAL OPERATIONS AND PROCEDURES CAUSING ABNORMAL PATIENT REACTION, OR LATER COMPLICATION, WITHOUT MENTION OF MISADVENTURE AT TIME OF OPERATION",2
82021,INTERTROCHANTERIC FX-CL,CLOSED FRACTURE OF INTERTROCHANTERIC SECTION OF NECK OF FEMUR,1
42832,CHR DIASTOLIC HRT FAIL,CHRONIC DIASTOLIC HEART FAILURE,6
99811,HEMORRHAGE COMPLIC PROC,HEMORRHAGE COMPLICATING A PROCEDURE,1
4414,ABDOM AORTIC ANEURYSM,ABDOMINAL ANEURYSM WITHOUT MENTION OF RUPTURE,1
45829,IATROGENC HYPOTNSION NEC,OTHER IATROGENIC HYPOTENSION,3
71615,TRAUM ARTHROPATHY-PELVIS,"TRAUMATIC ARTHROPATHY, PELVIC REGION AND THIGH",1
E9352,ADV EFF OPIATES,OTHER OPIATES AND RELATED NARCOTICS CAUSING ADVERSE EFFECTS IN THERAPEUTIC USE,1
78603,APNEA,APNEA,1
725,POLYMYALGIA RHEUMATICA,POLYMYALGIA RHEUMATICA,2
42821,AC SYSTOLIC HRT FAILURE,ACUTE SYSTOLIC HEART FAILURE,4
7213,LUMBOSACRAL SPONDYLOSIS,LUMBOSACRAL SPONDYLOSIS WITHOUT MYELOPATHY,1
2721,PURE HYPERGLYCERIDEMIA,PURE HYPERGLYCERIDEMIA,1
73730,IDIOPATHIC SCOLIOSIS,"SCOLIOSIS [AND KYPHOSCOLIOSIS], IDIOPATHIC",1
V103,HX OF BREAST MALIGNANCY,PERSONAL HISTORY OF MALIGNANT NEOPLASM OF BREAST,7
00845,INT INF CLSTRDIUM DFCILE,INTESTINAL INFECTION DUE TO CLOSTRIDIUM DIFFICILE,5
V153,HX OF IRRADIATION,"PERSONAL HISTORY OF IRRADIATION, PRESENTING HAZARDS TO HEALTH",2
5180,PULMONARY COLLAPSE,PULMONARY COLLAPSE,4
V8741,HX ANTINEOPLASTIC CHEMO,PERSONAL HISTORY OF ANTINEOPLASTIC CHEMOTHERAPY,3
48242,METH RES PNEU D/T STAPH,METHICILLIN RESISTANT PNEUMONIA DUE TO STAPHYLOCOCCUS AUREUS,1
53084,TRACHEOESOPHAGEAL FSTULA,TRACHEOESOPHAGEAL FISTULA,1
1629,MAL NEO BRONCH/LUNG NOS,"MALIGNANT NEOPLASM OF BRONCHUS AND LUNG, UNSPECIFIED",2
42732,ATRIAL FLUTTER,ATRIAL FLUTTER,1
99731,VENTLTR ASSOC PNEUMONIA,VENTILATOR ASSOCIATED PNEUMONIA,2
53089,OTHER DSRDERS ESOPHAGUS,OTHER SPECIFIED DISORDERS OF ESOPHAGUS,1
4011,BENIGN HYPERTENSION,BENIGN ESSENTIAL HYPERTENSION,1
78724,"DYSPHAGIA,PHARYNGOESOPH","DYSPHAGIA, PHARYNGOESOPHAGEAL PHASE",1
79029,ABNORMAL GLUCOSE NEC,OTHER ABNORMAL GLUCOSE,1
49390,ASTHMA NOS,"ASTHMA, UNSPECIFIED TYPE, UNSPECIFIED",5
41001,"AMI ANTEROLATERAL, INIT","ACUTE MYOCARDIAL INFARCTION OF ANTEROLATERAL WALL, INITIAL EPISODE OF CARE",1
27801,MORBID OBESITY,MORBID OBESITY,3
49121,OBS CHR BRONC W(AC) EXAC,OBSTRUCTIVE CHRONIC BRONCHITIS WITH (ACUTE) EXACERBATION,4
4168,CHR PULMON HEART DIS NEC,OTHER CHRONIC PULMONARY HEART DISEASES,2
29562,SCHIZOPHR DIS RESID-CHR,"SCHIZOPHRENIC DISORDERS, RESIDUAL TYPE, CHRONIC",2
70712,ULCER OF CALF,ULCER OF CALF,1
V433,HEART VALVE REPLAC NEC,HEART VALVE REPLACED BY OTHER MEANS,2
53081,ESOPHAGEAL REFLUX,ESOPHAGEAL REFLUX,13
78820,RETENTION URINE NOS,"RETENTION OF URINE, UNSPECIFIED",1
03849,GRAM-NEG SEPTICEMIA NEC,OTHER SEPTICEMIA DUE TO GRAM-NEGATIVE ORGANISMS,3
59970,HEMATURIA NOS,"HEMATURIA, UNSPECIFIED",2
5989,URETHRAL STRICTURE NOS,"URETHRAL STRICTURE, UNSPECIFIED",1
53642,GASTROSTOMY COMP - MECH,MECHANICAL COMPLICATION OF GASTROSTOMY,1
51909,TRACHEOSTOMY COMP NEC,OTHER TRACHEOSTOMY COMPLICATIONS,1
E8798,ABN REACT-PROCEDURE NEC,"OTHER SPECIFIED PROCEDURES AS THE CAUSE OF ABNORMAL REACTION OF PATIENT, OR OF LATER COMPLICATION, WITHOUT MENTION OF MISADVENTURE AT TIME OF PROCEDURE",3
43810,LATE EF-SPCH/LNG DEF NOS,"LATE EFFECTS OF CEREBROVASCULAR DISEASE, SPEECH AND LANGUAGE DEFICIT, UNSPECIFIED",2
V4984,BED CONFINEMENT STATUS,BED CONFINEMENT STATUS,1
25062,DMII NEURO UNCNTRLD,"DIABETES WITH NEUROLOGICAL MANIFESTATIONS, TYPE II OR UNSPECIFIED TYPE, UNCONTROLLED",1
1120,THRUSH,CANDIDIASIS OF MOUTH,1
0417,PSEUDOMONAS INFECT NOS,PSEUDOMONAS INFECTION IN CONDITIONS CLASSIFIED ELSEWHERE AND OF UNSPECIFIED SITE,1
70705,"PRESSURE ULCER, BUTTOCK","PRESSURE ULCER, BUTTOCK",2
V1302,PERSONAL HISTORY UTI,"PERSONAL HISTORY, URINARY (TRACT) INFECTION",3
70724,"PRESSURE ULCER, STAGE IV","PRESSURE ULCER, STAGE IV",2
V1204,HX METHICLN RESIST STAPH,PERSONAL HISTORY OF METHICILLIN RESISTANT STAPHYLOCOCCUS AUREUS,2
34400,"QUADRIPLEGIA, UNSPECIFD","QUADRIPLEGIA, UNSPECIFIED",1
2752,DIS MAGNESIUM METABOLISM,DISORDERS OF MAGNESIUM METABOLISM,1
59960,URINARY OBSTRUCTION NOS,"URINARY OBSTRUCTION, UNSPECIFIED",1
28860,LEUKOCYTOSIS NOS,"LEUKOCYTOSIS, UNSPECIFIED",1
2689,VITAMIN D DEFICIENCY NOS,UNSPECIFIED VITAMIN D DEFICIENCY,1
33829,CHRONIC PAIN NEC,OTHER CHRONIC PAIN,1
V4986,DO NOT RESUSCTATE STATUS,DO NOT RESUSCITATE STATUS,1
V4572,ACQUIRE ABSNCE INTESTINE,ACQUIRED ABSENCE OF INTESTINE (LARGE) (SMALL),1
2762,ACIDOSIS,ACIDOSIS,13
5780,HEMATEMESIS,HEMATEMESIS,1
53019,OTHER ESOPHAGITIS,OTHER ESOPHAGITIS,1
43889,LATE EFFECT CV DIS NEC,OTHER LATE EFFECTS OF CEREBROVASCULAR DISEASE,2
1890,MALIG NEOPL KIDNEY,"MALIGNANT NEOPLASM OF KIDNEY, EXCEPT PELVIS",1
1966,MAL NEO LYMPH-INTRAPELV,SECONDARY AND UNSPECIFIED MALIGNANT NEOPLASM OF INTRAPELVIC LYMPH NODES,1
9982,ACCIDENTAL OP LACERATION,"ACCIDENTAL PUNCTURE OR LACERATION DURING A PROCEDURE, NOT ELSEWHERE CLASSIFIED",1
E8700,ACC CUT/HEM IN SURGERY,"ACCIDENTAL CUT, PUNCTURE, PERFORATION OR HEMORRHAGE DURING SURGICAL OPERATION",1
E8120,MV COLLISION NOS-DRIVER,OTHER MOTOR VEHICLE TRAFFIC ACCIDENT INVOLVING COLLISION WITH MOTOR VEHICLE INJURING DRIVER OF MOTOR VEHICLE OTHER THAN MOTORCYCLE,2
E8495,ACCID ON STREET/HIGHWAY,STREET AND HIGHWAY ACCIDENTS,2
8830,OPEN WOUND OF FINGER,"OPEN WOUND OF FINGER(S), WITHOUT MENTION OF COMPLICATION",1
29181,ALCOHOL WITHDRAWAL,ALCOHOL WITHDRAWAL,1
25080,DMII OTH NT ST UNCNTRLD,"DIABETES WITH OTHER SPECIFIED MANIFESTATIONS, TYPE II OR UNSPECIFIED TYPE, NOT STATED AS UNCONTROLLED",1
30301,AC ALCOHOL INTOX-CONTIN,"ACUTE ALCOHOLIC INTOXICATION IN ALCOHOLISM, CONTINUOUS",1
V425,CORNEA TRANSPLANT STATUS,CORNEA REPLACED BY TRANSPLANT,1
25070,DMII CIRC NT ST UNCNTRLD,"DIABETES WITH PERIPHERAL CIRCULATORY DISORDERS, TYPE II OR UNSPECIFIED TYPE, NOT STATED AS UNCONTROLLED",1
44020,ATHSCL EXTRM NTV ART NOS,"ATHEROSCLEROSIS OF NATIVE ARTERIES OF THE EXTREMITIES, UNSPECIFIED",1
99631,MALFUNC URETHRAL CATH,MECHANICAL COMPLICATION DUE TO URETHRAL (INDWELLING) CATHETER,1
E8497,ACCID IN RESIDENT INSTIT,ACCIDENTS OCCURRING IN RESIDENTIAL INSTITUTION,1
3310,ALZHEIMER'S DISEASE,ALZHEIMER'S DISEASE,2
29410,DEMENTIA W/O BEHAV DIST,DEMENTIA IN CONDITIONS CLASSIFIED ELSEWHERE WITHOUT BEHAVIORAL DISTURBANCE,2
30000,ANXIETY STATE NOS,"ANXIETY STATE, UNSPECIFIED",2
8600,TRAUM PNEUMOTHORAX-CLOSE,TRAUMATIC PNEUMOTHORAX WITHOUT MENTION OF OPEN WOUND INTO THORAX,1
75321,CONGEN OBST URTROPLV JNC,CONGENITAL OBSTRUCTION OF URETEROPELVIC JUNCTION,1
27650,VOLUME DEPLETION NOS,"VOLUME DEPLETION, UNSPECIFIED",1
43850,LT EF OTH PARAL SIDE NOS,"LATE EFFECTS OF CEREBROVASCULAR DISEASE, OTHER PARALYTIC SYNDROME AFFECTING UNSPECIFIED SIDE",1
V667,ENCOUNTR PALLIATIVE CARE,ENCOUNTER FOR PALLIATIVE CARE,2
3659,GLAUCOMA NOS,UNSPECIFIED GLAUCOMA,3
V4501,STATUS CARDIAC PACEMAKER,CARDIAC PACEMAKER IN SITU,3
79902,HYPOXEMIA,HYPOXEMIA,2
5602,VOLVULUS OF INTESTINE,VOLVULUS,1
3963,MITRAL/AORTIC VAL INSUFF,MITRAL VALVE INSUFFICIENCY AND AORTIC VALVE INSUFFICIENCY,1
4589,HYPOTENSION NOS,"HYPOTENSION, UNSPECIFIED",2
V1083,HX-SKIN MALIGNANCY NEC,PERSONAL HISTORY OF OTHER MALIGNANT NEOPLASM OF SKIN,2
2764,MIXED ACID-BASE BAL DIS,MIXED ACID-BASE BALANCE DISORDER,1
4254,PRIM CARDIOMYOPATHY NEC,OTHER PRIMARY CARDIOMYOPATHIES,1
3968,MITR/AORTIC MULT INVOLV,MULTIPLE INVOLVEMENT OF MITRAL AND AORTIC VALVES,1
37230,CONJUNCTIVITIS NOS,"CONJUNCTIVITIS, UNSPECIFIED",1
28521,ANEMIA IN CHR KIDNEY DIS,ANEMIA IN CHRONIC KIDNEY DISEASE,3
E9308,ADV EFF ANTIBIOTICS NEC,OTHER SPECIFIED ANTIBIOTICS CAUSING ADVERSE EFFECTS IN THERAPEUTIC USE,2
60000,BPH W/O URINARY OBS/LUTS,HYPERTROPHY (BENIGN) OF PROSTATE WITHOUT URINARY OBSTRUCTION AND OTHER LOWER URINARY TRACT SYMPTOM (LUTS),2
2511,OTH SPCF HYPOGLYCEMIA,OTHER SPECIFIED HYPOGLYCEMIA,1
8670,BLADDER/URETHRA INJ-CLOS,"INJURY TO BLADDER AND URETHRA, WITHOUT MENTION OF OPEN WOUND INTO CAVITY",1
59971,GROSS HEMATURIA,GROSS HEMATURIA,1
4149,CHR ISCHEMIC HRT DIS NOS,"CHRONIC ISCHEMIC HEART DISEASE, UNSPECIFIED",1
V1272,PRSNL HST COLONIC POLYPS,PERSONAL HISTORY OF COLONIC POLYPS,2
E9289,ACCIDENT NOS,UNSPECIFIED ACCIDENT,1
43411,CRBL EMBLSM W INFRCT,CEREBRAL EMBOLISM WITH CEREBRAL INFARCTION,1
3484,COMPRESSION OF BRAIN,COMPRESSION OF BRAIN,1
1510,MAL NEO STOMACH CARDIA,MALIGNANT NEOPLASM OF CARDIA,2
04112,MRSA ELSEWHERE/NOS,METHICILLIN RESISTANT STAPHYLOCOCCUS AUREUS IN CONDITIONS CLASSIFIED ELSEWHERE AND OF UNSPECIFIED SITE,2
51189,EFFUSION NEC EXC TB,"OTHER SPECIFIED FORMS OF EFFUSION, EXCEPT TUBERCULOUS",1
47831,VOCAL PARAL UNILAT PART,"UNILATERAL PARALYSIS OF VOCAL CORDS OR LARYNX, PARTIAL",1
5109,EMPYEMA W/O FISTULA,EMPYEMA WITHOUT MENTION OF FISTULA,1
41041,"AMI INFERIOR WALL, INIT","ACUTE MYOCARDIAL INFARCTION OF OTHER INFERIOR WALL, INITIAL EPISODE OF CARE",2
V8801,ACQ ABSNCE CERVIX/UTERUS,ACQUIRED ABSENCE OF BOTH CERVIX AND UTERUS,1
36250,MACULAR DEGENERATION NOS,"MACULAR DEGENERATION (SENILE), UNSPECIFIED",2
V4571,ACQ ABSNCE BREAST/NIPPLE,ACQUIRED ABSENCE OF BREAST AND NIPPLE,1
1628,MAL NEO BRONCH/LUNG NEC,MALIGNANT NEOPLASM OF OTHER PARTS OF BRONCHUS OR LUNG,4
2536,NEUROHYPOPHYSIS DIS NEC,OTHER DISORDERS OF NEUROHYPOPHYSIS,1
7991,RESPIRATORY ARREST,RESPIRATORY ARREST,1
72400,SPINAL STENOSIS NOS,"SPINAL STENOSIS, UNSPECIFIED REGION",3
71690,ARTHROPATHY NOS-UNSPEC,"ARTHROPATHY, UNSPECIFIED, SITE UNSPECIFIED",1
4549,ASYMPT VARICOSE VEINS,ASYMPTOMATIC VARICOSE VEINS,1
81249,FX LOWER HUMERUS NEC-CL,OTHER CLOSED FRACTURE OF LOWER END OF HUMERUS,1
4928,EMPHYSEMA NEC,OTHER EMPHYSEMA,3
40291,HYP HT DIS NOS W HT FAIL,UNSPECIFIED HYPERTENSIVE HEART DISEASE WITH HEART FAILURE,1
2809,IRON DEFIC ANEMIA NOS,"IRON DEFICIENCY ANEMIA, UNSPECIFIED",1
42831,AC DIASTOLIC HRT FAILURE,ACUTE DIASTOLIC HEART FAILURE,2
78559,SHOCK W/O TRAUMA NEC,OTHER SHOCK WITHOUT MENTION OF TRAUMA,3
48282,PNEUMONIA E COLI,PNEUMONIA DUE TO ESCHERICHIA COLI [E. COLI],1
34591,EPILEPSY NOS W INTR EPIL,"EPILEPSY, UNSPECIFIED, WITH INTRACTABLE EPILEPSY",1
78001,COMA,COMA,1
319,INTELLECT DISABILITY NOS,UNSPECIFIED INTELLECTUAL DISABILITIES,2
490,BRONCHITIS NOS,"BRONCHITIS, NOT SPECIFIED AS ACUTE OR CHRONIC",2
04111,MTH SUS STPH AUR ELS/NOS,METHICILLIN SUSCEPTIBLE STAPHYLOCOCCUS AUREUS IN CONDITIONS CLASSIFIED ELSEWHERE AND OF UNSPECIFIED SITE,1
29040,"VASCULAR DEMENTIA,UNCOMP","VASCULAR DEMENTIA, UNCOMPLICATED",1
44031,ATH EXT AUTOLOGS BPS GFT,ATHEROSCLEROSIS OF AUTOLOGOUS VEIN BYPASS GRAFT OF THE EXTREMITIES,1
56210,DVRTCLO COLON W/O HMRHG,DIVERTICULOSIS OF COLON (WITHOUT MENTION OF HEMORRHAGE),2
5781,BLOOD IN STOOL,BLOOD IN STOOL,2
2273,BENIGN NEO PITUITARY,BENIGN NEOPLASM OF PITUITARY GLAND AND CRANIOPHARYNGEAL DUCT,2
2532,PANHYPOPITUITARISM,PANHYPOPITUITARISM,1
70706,"PRESSURE ULCER, ANKLE","PRESSURE ULCER, ANKLE",1
4111,INTERMED CORONARY SYND,INTERMEDIATE CORONARY SYNDROME,1
29281,DRUG-INDUCED DELIRIUM,DRUG-INDUCED DELIRIUM,1
E9394,ADV EFF BENZODIAZ TRANQ,BENZODIAZEPINE-BASED TRANQUILIZERS CAUSING ADVERSE EFFECTS IN THERAPEUTIC USE,1
2867,ACQ COAGUL FACTOR DEFIC,ACQUIRED COAGULATION FACTOR DEFICIENCY,1
28959,SPLEEN DISEASE NEC,OTHER DISEASES OF SPLEEN,2
99682,COMPL LIVER TRANSPLANT,COMPLICATIONS OF TRANSPLANTED LIVER,2
07032,HPT B CHRN WO CM WO DLTA,CHRONIC VIRAL HEPATITIS B WITHOUT MENTION OF HEPATIC COMA WITHOUT MENTION OF HEPATITIS DELTA,1
56881,HEMOPERITONEUM,HEMOPERITONEUM (NONTRAUMATIC),1
5762,OBSTRUCTION OF BILE DUCT,OBSTRUCTION OF BILE DUCT,1
42823,AC ON CHR SYST HRT FAIL,ACUTE ON CHRONIC SYSTOLIC HEART FAILURE,1
2811,B12 DEFIC ANEMIA NEC,OTHER VITAMIN B12 DEFICIENCY ANEMIA,1
42833,AC ON CHR DIAST HRT FAIL,ACUTE ON CHRONIC DIASTOLIC HEART FAILURE,1
V1581,HX OF PAST NONCOMPLIANCE,"PERSONAL HISTORY OF NONCOMPLIANCE WITH MEDICAL TREATMENT, PRESENTING HAZARDS TO HEALTH",2
